Ether / IP / TCP 192.168.72.158:33646 > 36.155.132.3:https PA / Raw
Ether / IP / TCP 192.168.72.158:33646 > 36.155.132.3:https PA / Raw
Ether / IP / TCP 192.168.72.158:33646 > 36.155.132.3:https PA / Raw
Ether / IP / TCP 192.168.72.158:33656 > 36.155.132.3:https PA / Raw
Ether / IP / TCP 192.168.72.158:33656 > 36.155.132.3:https PA / Raw
Ether / IP / TCP 192.168.72.158:33656 > 36.155.132.3:https PA / Raw
Ether / IP / TCP 192.168.72.158:33646 > 36.155.132.3:https PA / Raw
Ether / IP / TCP 192.168.72.158:33646 > 36.155.132.3:https PA / Raw
Ether / IP / TCP 192.168.72.158:36322 > 36.155.132.3:https PA / Raw
Ether / IP / TCP 192.168.72.158:36322 > 36.155.132.3:https PA / Raw
Ether / IP / TCP 192.168.72.158:36322 > 36.155.132.3:https PA / Raw
Ether / IP / TCP 192.168.72.158:36322 > 36.155.132.3:https PA / Raw
Ether / IP / TCP 192.168.72.158:33646 > 36.155.132.3:https PA / Raw
Ether / IP / TCP 192.168.72.158:33646 > 36.155.132.3:https PA / Raw
Ether / IP / TCP 192.168.72.158:33646 > 36.155.132.3:https PA / Raw
Ether / IP / TCP 192.168.72.158:33656 > 36.155.132.3:https PA / Raw
Ether / IP / TCP 192.168.72.158:33646 > 36.155.132.3:https PA / Raw
Ether / IP / TCP 192.168.72.158:33646 > 36.155.132.3:https PA / Raw
Ether / IP / TCP 192.168.72.158:33646 > 36.155.132.3:https PA / Raw
Ether / IP / TCP 192.168.72.158:33646 > 36.155.132.3:https PA / Raw
Ether / IP / TCP 192.168.72.158:33656 > 36.155.132.3:https PA / Raw
Ether / IP / TCP 192.168.72.158:33646 > 36.155.132.3:https PA / Raw
Ether / IP / TCP 192.168.72.158:33646 > 36.155.132.3:https PA / Raw
Ether / IP / TCP 192.168.72.158:36322 > 36.155.132.3:https PA / Raw
Ether / IP / TCP 192.168.72.158:33646 > 36.155.132.3:https PA / Raw
Ether / IP / TCP 192.168.72.158:36322 > 36.155.132.3:https PA / Raw
Ether / IP / TCP 192.168.72.158:33646 > 36.155.132.3:https PA / Raw
Ether / IP / TCP 192.168.72.158:36324 > 36.155.132.3:https PA / Raw
Ether / IP / TCP 192.168.72.158:36324 > 36.155.132.3:https PA / Raw
Ether / IP / TCP 192.168.72.158:33646 > 36.155.132.3:https PA / Raw
Ether / IP / TCP 192.168.72.158:36324 > 36.155.132.3:https PA / Raw
Ether / IP / TCP 192.168.72.158:36324 > 36.155.132.3:https PA / Raw
Ether / IP / TCP 192.168.72.158:33656 > 36.155.132.3:https PA / Raw
Ether / IP / TCP 192.168.72.158:36324 > 36.155.132.3:https PA / Raw
Ether / IP / TCP 192.168.72.158:36324 > 36.155.132.3:https PA / Raw
Ether / IP / TCP 192.168.72.158:33656 > 36.155.132.3:https PA / Raw
Ether / IP / TCP 192.168.72.158:36324 > 36.155.132.3:https PA / Raw
Ether / IP / TCP 192.168.72.158:33656 > 36.155.132.3:https PA / Raw
Ether / IP / TCP 192.168.72.158:36324 > 36.155.132.3:https PA / Raw
Ether / IP / TCP 192.168.72.158:36324 > 36.155.132.3:https PA / Raw
Ether / IP / TCP 192.168.72.158:33656 > 36.155.132.3:https PA / Raw
Ether / IP / TCP 192.168.72.158:36324 > 36.155.132.3:https PA / Raw
Ether / IP / TCP 192.168.72.158:36324 > 36.155.132.3:https PA / Raw
Ether / IP / TCP 192.168.72.158:33656 > 36.155.132.3:https PA / Raw
Ether / IP / TCP 192.168.72.158:36324 > 36.155.132.3:https PA / Raw
Ether / IP / TCP 192.168.72.158:33656 > 36.155.132.3:https PA / Raw
Ether / IP / TCP 192.168.72.158:36324 > 36.155.132.3:https PA / Raw
Ether / IP / TCP 192.168.72.158:33656 > 36.155.132.3:https PA / Raw
Ether / IP / TCP 192.168.72.158:36324 > 36.155.132.3:https PA / Raw
Ether / IP / TCP 192.168.72.158:33656 > 36.155.132.3:https PA / Raw
Ether / IP / TCP 192.168.72.158:36324 > 36.155.132.3:https PA / Raw
Ether / IP / TCP 192.168.72.158:33656 > 36.155.132.3:https PA / Raw
Ether / IP / TCP 192.168.72.158:36324 > 36.155.132.3:https PA / Raw
Ether / IP / TCP 192.168.72.158:33656 > 36.155.132.3:https PA / Raw
Ether / IP / TCP 192.168.72.158:36324 > 36.155.132.3:https PA / Raw
Ether / IP / TCP 192.168.72.158:33656 > 36.155.132.3:https PA / Raw
Ether / IP / TCP 192.168.72.158:36324 > 36.155.132.3:https PA / Raw
Ether / IP / TCP 192.168.72.158:33656 > 36.155.132.3:https PA / Raw
Ether / IP / TCP 192.168.72.158:36324 > 36.155.132.3:https PA / Raw
Ether / IP / TCP 192.168.72.158:33656 > 36.155.132.3:https PA / Raw
Ether / IP / TCP 192.168.72.158:36324 > 36.155.132.3:https PA / Raw
Ether / IP / TCP 192.168.72.158:33656 > 36.155.132.3:https PA / Raw
Ether / IP / TCP 192.168.72.158:36324 > 36.155.132.3:https PA / Raw
Ether / IP / TCP 192.168.72.158:33646 > 36.155.132.3:https PA / Raw
Ether / IP / TCP 192.168.72.158:33646 > 36.155.132.3:https PA / Raw
Ether / IP / TCP 192.168.72.158:33646 > 36.155.132.3:https PA / Raw
Ether / IP / TCP 192.168.72.158:33646 > 36.155.132.3:https PA / Raw
Ether / IP / TCP 192.168.72.158:33656 > 36.155.132.3:https PA / Raw
Ether / IP / TCP 192.168.72.158:33646 > 36.155.132.3:https PA / Raw
Ether / IP / TCP 192.168.72.158:33656 > 36.155.132.3:https PA / Raw
Ether / IP / TCP 192.168.72.158:33646 > 36.155.132.3:https PA / Raw
Ether / IP / TCP 192.168.72.158:33656 > 36.155.132.3:https PA / Raw
Ether / IP / TCP 192.168.72.158:33646 > 36.155.132.3:https PA / Raw
Ether / IP / TCP 192.168.72.158:33646 > 36.155.132.3:https PA / Raw
Ether / IP / TCP 192.168.72.158:33646 > 36.155.132.3:https PA / Raw
Ether / IP / TCP 192.168.72.158:33656 > 36.155.132.3:https PA / Raw
Ether / IP / TCP 192.168.72.158:33646 > 36.155.132.3:https PA / Raw
Ether / IP / TCP 192.168.72.158:33656 > 36.155.132.3:https PA / Raw
Ether / IP / TCP 192.168.72.158:33646 > 36.155.132.3:https PA / Raw
Ether / IP / TCP 192.168.72.158:36324 > 36.155.132.3:https PA / Raw
Ether / IP / TCP 192.168.72.158:33646 > 36.155.132.3:https PA / Raw
Ether / IP / TCP 192.168.72.158:33646 > 36.155.132.3:https PA / Raw
Ether / IP / TCP 192.168.72.158:33646 > 36.155.132.3:https PA / Raw
Ether / IP / TCP 192.168.72.158:33656 > 36.155.132.3:https PA / Raw
Ether / IP / TCP 192.168.72.158:33646 > 36.155.132.3:https PA / Raw
Ether / IP / TCP 192.168.72.158:33646 > 36.155.132.3:https PA / Raw
Ether / IP / TCP 192.168.72.158:33646 > 36.155.132.3:https PA / Raw
Ether / IP / TCP 192.168.72.158:36324 > 36.155.132.3:https PA / Raw
Ether / IP / TCP 192.168.72.158:33646 > 36.155.132.3:https PA / Raw
Ether / IP / TCP 192.168.72.158:33646 > 36.155.132.3:https PA / Raw
Ether / IP / TCP 192.168.72.158:36324 > 36.155.132.3:https PA / Raw
Ether / IP / TCP 192.168.72.158:36324 > 36.155.132.3:https PA / Raw
Ether / IP / TCP 192.168.72.158:42686 > 36.155.132.3:https PA / Raw
Ether / IP / TCP 192.168.72.158:42686 > 36.155.132.3:https PA / Raw
Ether / IP / TCP 192.168.72.158:42686 > 36.155.132.3:https PA / Raw
Ether / IP / TCP 192.168.72.158:42694 > 36.155.132.3:https PA / Raw
Ether / IP / TCP 192.168.72.158:42694 > 36.155.132.3:https PA / Raw
Ether / IP / TCP 192.168.72.158:42694 > 36.155.132.3:https PA / Raw
Ether / IP / TCP 192.168.72.158:42686 > 36.155.132.3:https PA / Raw
Ether / IP / TCP 192.168.72.158:42686 > 36.155.132.3:https PA / Raw
