Ether / IP / TCP 192.168.32.1:http > 192.168.32.140:49170 PA / Raw
Ether / IP / TCP 192.168.32.140:49172 > 192.168.32.1:http PA / Raw
Ether / IP / TCP 192.168.32.140:49172 > 192.168.32.1:http PA / Raw
Ether / IP / TCP 192.168.32.1:http > 192.168.32.140:49172 PA / Raw
Ether / IP / TCP 192.168.32.1:http > 192.168.32.140:49172 PA / Raw
Ether / IP / TCP 192.168.32.140:49172 > 192.168.32.1:http PA / Raw
Ether / IP / TCP 192.168.32.140:49172 > 192.168.32.1:http PA / Raw
Ether / IP / TCP 192.168.32.1:http > 192.168.32.140:49172 PA / Raw
Ether / IP / TCP 192.168.32.140:49172 > 192.168.32.1:http PA / Raw
Ether / IP / TCP 192.168.32.140:49172 > 192.168.32.1:http PA / Raw
