Ether / IP / TCP 47.94.251.227:8280 > 172.29.27.102:6193 PA / Raw
Ether / IP / TCP 47.94.251.227:8280 > 172.29.27.102:6193 PA / Raw
Ether / IP / TCP 47.94.251.227:8280 > 172.29.27.102:6193 PA / Raw
Ether / IP / TCP 47.94.251.227:8280 > 172.29.27.102:6193 PA / Raw
Ether / IP / TCP 47.94.251.227:8280 > 172.29.27.102:6193 PA / Raw
Ether / IP / TCP 47.94.251.227:8280 > 172.29.27.102:6193 PA / Raw
Ether / IP / TCP 47.94.251.227:8280 > 172.29.27.102:6193 PA / Raw
Ether / IP / TCP 47.94.251.227:8280 > 172.29.27.102:6193 PA / Raw
Ether / IP / TCP 47.94.251.227:8280 > 172.29.27.102:6193 PA / Raw
Ether / IP / TCP 47.94.251.227:8280 > 172.29.27.102:6193 PA / Raw
Ether / IP / TCP 47.94.251.227:8280 > 172.29.27.102:6193 PA / Raw
Ether / IP / TCP 47.94.251.227:8280 > 172.29.27.102:6193 PA / Raw
Ether / IP / TCP 47.94.251.227:8280 > 172.29.27.102:6193 PA / Raw
Ether / IP / TCP 47.94.251.227:8280 > 172.29.27.102:6193 PA / Raw
Ether / IP / TCP 47.94.251.227:8280 > 172.29.27.102:6193 PA / Raw
Ether / IP / TCP 47.94.251.227:8280 > 172.29.27.102:6193 PA / Raw
Ether / IP / TCP 47.94.251.227:8280 > 172.29.27.102:6193 PA / Raw
Ether / IP / TCP 47.94.251.227:8280 > 172.29.27.102:6193 PA / Raw
Ether / IP / TCP 47.94.251.227:8280 > 172.29.27.102:6193 PA / Raw
Ether / IP / TCP 47.94.251.227:8280 > 172.29.27.102:6193 PA / Raw
Ether / IP / TCP 47.94.251.227:8280 > 172.29.27.102:6193 PA / Raw
Ether / IP / TCP 47.94.251.227:8280 > 172.29.27.102:6193 PA / Raw
Ether / IP / TCP 47.94.251.227:8280 > 172.29.27.102:6193 PA / Raw
Ether / IP / TCP 47.94.251.227:8280 > 172.29.27.102:6193 PA / Raw
Ether / IP / TCP 47.94.251.227:8280 > 172.29.27.102:6193 PA / Raw
Ether / IP / TCP 47.94.251.227:8280 > 172.29.27.102:6193 PA / Raw
Ether / IP / TCP 47.94.251.227:8280 > 172.29.27.102:6193 PA / Raw
Ether / IP / TCP 47.94.251.227:8280 > 172.29.27.102:6193 PA / Raw
Ether / IP / TCP 47.94.251.227:8280 > 172.29.27.102:6193 PA / Raw
Ether / IP / TCP 47.94.251.227:8280 > 172.29.27.102:6193 PA / Raw
Ether / IP / TCP 47.94.251.227:8280 > 172.29.27.102:6193 PA / Raw
Ether / IP / TCP 47.94.251.227:8280 > 172.29.27.102:6193 PA / Raw
Ether / IP / TCP 47.94.251.227:8280 > 172.29.27.102:6193 PA / Raw
Ether / IP / TCP 47.94.251.227:8280 > 172.29.27.102:6193 PA / Raw
Ether / IP / TCP 47.94.251.227:8280 > 172.29.27.102:6193 PA / Raw
Ether / IP / TCP 47.94.251.227:8280 > 172.29.27.102:6193 PA / Raw
Ether / IP / TCP 47.94.251.227:8280 > 172.29.27.102:6193 PA / Raw
Ether / IP / TCP 47.94.251.227:8280 > 172.29.27.102:6193 PA / Raw
Ether / IP / TCP 47.94.251.227:8280 > 172.29.27.102:6193 PA / Raw
Ether / IP / TCP 47.94.251.227:8280 > 172.29.27.102:6193 PA / Raw
Ether / IP / TCP 47.94.251.227:8280 > 172.29.27.102:6193 PA / Raw
Ether / IP / TCP 47.94.251.227:8280 > 172.29.27.102:6193 PA / Raw
Ether / IP / TCP 47.94.251.227:8280 > 172.29.27.102:6193 PA / Raw
Ether / IP / TCP 47.94.251.227:8280 > 172.29.27.102:6193 PA / Raw
Ether / IP / TCP 47.94.251.227:8280 > 172.29.27.102:6193 PA / Raw
Ether / IP / TCP 47.94.251.227:8280 > 172.29.27.102:6193 PA / Raw
Ether / IP / TCP 47.94.251.227:8280 > 172.29.27.102:6193 PA / Raw
Ether / IP / TCP 47.94.251.227:8280 > 172.29.27.102:6193 PA / Raw
Ether / IP / TCP 47.94.251.227:8280 > 172.29.27.102:6193 PA / Raw
Ether / IP / TCP 47.94.251.227:8280 > 172.29.27.102:6193 PA / Raw
Ether / IP / TCP 47.94.251.227:8280 > 172.29.27.102:6193 PA / Raw
Ether / IP / TCP 47.94.251.227:8280 > 172.29.27.102:6193 PA / Raw
Ether / IP / TCP 47.94.251.227:8280 > 172.29.27.102:6193 PA / Raw
Ether / IP / TCP 47.94.251.227:8280 > 172.29.27.102:6193 PA / Raw
Ether / IP / TCP 47.94.251.227:8280 > 172.29.27.102:6193 PA / Raw
Ether / IP / TCP 47.94.251.227:8280 > 172.29.27.102:6193 PA / Raw
Ether / IP / TCP 47.94.251.227:8280 > 172.29.27.102:6193 PA / Raw
Ether / IP / TCP 47.94.251.227:8280 > 172.29.27.102:6193 PA / Raw
Ether / IP / TCP 47.94.251.227:8280 > 172.29.27.102:6193 PA / Raw
Ether / IP / TCP 47.94.251.227:8280 > 172.29.27.102:6193 PA / Raw
Ether / IP / TCP 47.94.251.227:8280 > 172.29.27.102:6193 PA / Raw
Ether / IP / TCP 47.94.251.227:8280 > 172.29.27.102:6193 PA / Raw
Ether / IP / TCP 47.94.251.227:8280 > 172.29.27.102:6193 PA / Raw
Ether / IP / TCP 47.94.251.227:8280 > 172.29.27.102:6193 PA / Raw
Ether / IP / TCP 47.94.251.227:8280 > 172.29.27.102:6193 PA / Raw
Ether / IP / TCP 47.94.251.227:8280 > 172.29.27.102:6193 PA / Raw
Ether / IP / TCP 47.94.251.227:8280 > 172.29.27.102:6193 PA / Raw
Ether / IP / TCP 47.94.251.227:8280 > 172.29.27.102:6193 PA / Raw
Ether / IP / TCP 47.94.251.227:8280 > 172.29.27.102:6193 PA / Raw
Ether / IP / TCP 47.94.251.227:8280 > 172.29.27.102:6193 PA / Raw
Ether / IP / TCP 47.94.251.227:8280 > 172.29.27.102:6193 PA / Raw
Ether / IP / TCP 47.94.251.227:8280 > 172.29.27.102:6193 PA / Raw
Ether / IP / TCP 47.94.251.227:8280 > 172.29.27.102:6193 PA / Raw
Ether / IP / TCP 47.94.251.227:8280 > 172.29.27.102:6193 PA / Raw
Ether / IP / TCP 47.94.251.227:8280 > 172.29.27.102:6193 PA / Raw
Ether / IP / TCP 47.94.251.227:8280 > 172.29.27.102:6193 PA / Raw
Ether / IP / TCP 47.94.251.227:8280 > 172.29.27.102:6193 PA / Raw
Ether / IP / TCP 47.94.251.227:8280 > 172.29.27.102:6193 PA / Raw
Ether / IP / TCP 47.94.251.227:8280 > 172.29.27.102:6193 PA / Raw
Ether / IP / TCP 47.94.251.227:8280 > 172.29.27.102:6193 PA / Raw
Ether / IP / TCP 47.94.251.227:8280 > 172.29.27.102:6193 PA / Raw
Ether / IP / TCP 47.94.251.227:8280 > 172.29.27.102:6193 PA / Raw
Ether / IP / TCP 47.94.251.227:8280 > 172.29.27.102:6193 PA / Raw
Ether / IP / TCP 47.94.251.227:8280 > 172.29.27.102:6193 PA / Raw
Ether / IP / TCP 47.94.251.227:8280 > 172.29.27.102:6193 PA / Raw
Ether / IP / TCP 47.94.251.227:8280 > 172.29.27.102:6193 PA / Raw
Ether / IP / TCP 47.94.251.227:8280 > 172.29.27.102:6193 PA / Raw
Ether / IP / TCP 47.94.251.227:8280 > 172.29.27.102:6193 PA / Raw
Ether / IP / TCP 47.94.251.227:8280 > 172.29.27.102:6193 PA / Raw
Ether / IP / TCP 47.94.251.227:8280 > 172.29.27.102:6193 PA / Raw
Ether / IP / TCP 47.94.251.227:8280 > 172.29.27.102:6193 PA / Raw
Ether / IP / TCP 47.94.251.227:8280 > 172.29.27.102:6193 PA / Raw
Ether / IP / TCP 47.94.251.227:8280 > 172.29.27.102:6193 PA / Raw
Ether / IP / TCP 47.94.251.227:8280 > 172.29.27.102:6193 PA / Raw
Ether / IP / TCP 47.94.251.227:8280 > 172.29.27.102:6193 PA / Raw
Ether / IP / TCP 47.94.251.227:8280 > 172.29.27.102:6193 PA / Raw
Ether / IP / TCP 47.94.251.227:8280 > 172.29.27.102:6193 PA / Raw
Ether / IP / TCP 47.94.251.227:8280 > 172.29.27.102:6193 PA / Raw
Ether / IP / TCP 47.94.251.227:8280 > 172.29.27.102:6193 PA / Raw
Ether / IP / TCP 47.94.251.227:8280 > 172.29.27.102:6193 PA / Raw
Ether / IP / TCP 47.94.251.227:8280 > 172.29.27.102:6193 PA / Raw
Ether / IP / TCP 47.94.251.227:8280 > 172.29.27.102:6193 PA / Raw
Ether / IP / TCP 47.94.251.227:8280 > 172.29.27.102:6193 PA / Raw
Ether / IP / TCP 47.94.251.227:8280 > 172.29.27.102:6193 PA / Raw
Ether / IP / TCP 47.94.251.227:8280 > 172.29.27.102:6193 PA / Raw
Ether / IP / TCP 47.94.251.227:8280 > 172.29.27.102:6193 PA / Raw
Ether / IP / TCP 47.94.251.227:8280 > 172.29.27.102:6193 PA / Raw
Ether / IP / TCP 47.94.251.227:8280 > 172.29.27.102:6193 PA / Raw
Ether / IP / TCP 47.94.251.227:8280 > 172.29.27.102:6193 PA / Raw
Ether / IP / TCP 47.94.251.227:8280 > 172.29.27.102:6193 PA / Raw
Ether / IP / TCP 47.94.251.227:8280 > 172.29.27.102:6193 PA / Raw
Ether / IP / TCP 47.94.251.227:8280 > 172.29.27.102:6193 PA / Raw
Ether / IP / TCP 47.94.251.227:8280 > 172.29.27.102:6193 PA / Raw
Ether / IP / TCP 47.94.251.227:8280 > 172.29.27.102:6193 PA / Raw
Ether / IP / TCP 47.94.251.227:8280 > 172.29.27.102:6193 PA / Raw
Ether / IP / TCP 47.94.251.227:8280 > 172.29.27.102:6193 PA / Raw
Ether / IP / TCP 47.94.251.227:8280 > 172.29.27.102:6193 PA / Raw
Ether / IP / TCP 47.94.251.227:8280 > 172.29.27.102:6193 PA / Raw
Ether / IP / TCP 47.94.251.227:8280 > 172.29.27.102:6193 PA / Raw
Ether / IP / TCP 47.94.251.227:8280 > 172.29.27.102:6193 PA / Raw
Ether / IP / TCP 47.94.251.227:8280 > 172.29.27.102:6193 PA / Raw
Ether / IP / TCP 47.94.251.227:8280 > 172.29.27.102:6193 PA / Raw
Ether / IP / TCP 47.94.251.227:8280 > 172.29.27.102:6193 PA / Raw
Ether / IP / TCP 47.94.251.227:8280 > 172.29.27.102:6193 PA / Raw
Ether / IP / TCP 47.94.251.227:8280 > 172.29.27.102:6193 PA / Raw
Ether / IP / TCP 47.94.251.227:8280 > 172.29.27.102:6193 PA / Raw
Ether / IP / TCP 47.94.251.227:8280 > 172.29.27.102:6193 PA / Raw
Ether / IP / TCP 47.94.251.227:8280 > 172.29.27.102:6193 PA / Raw
Ether / IP / TCP 47.94.251.227:8280 > 172.29.27.102:6193 PA / Raw
Ether / IP / TCP 47.94.251.227:8280 > 172.29.27.102:6193 PA / Raw
Ether / IP / TCP 47.94.251.227:8280 > 172.29.27.102:6193 PA / Raw
Ether / IP / TCP 47.94.251.227:8280 > 172.29.27.102:6193 PA / Raw
Ether / IP / TCP 47.94.251.227:8280 > 172.29.27.102:6193 PA / Raw
Ether / IP / TCP 47.94.251.227:8280 > 172.29.27.102:6193 PA / Raw
Ether / IP / TCP 47.94.251.227:8280 > 172.29.27.102:6193 PA / Raw
Ether / IP / TCP 47.94.251.227:8280 > 172.29.27.102:6193 PA / Raw
Ether / IP / TCP 47.94.251.227:8280 > 172.29.27.102:6193 PA / Raw
Ether / IP / TCP 47.94.251.227:8280 > 172.29.27.102:6193 PA / Raw
Ether / IP / TCP 47.94.251.227:8280 > 172.29.27.102:6193 PA / Raw
Ether / IP / TCP 47.94.251.227:8280 > 172.29.27.102:6193 PA / Raw
Ether / IP / TCP 47.94.251.227:8280 > 172.29.27.102:6193 PA / Raw
Ether / IP / TCP 47.94.251.227:8280 > 172.29.27.102:6193 PA / Raw
Ether / IP / TCP 47.94.251.227:8280 > 172.29.27.102:6193 PA / Raw
Ether / IP / TCP 47.94.251.227:8280 > 172.29.27.102:6193 PA / Raw
Ether / IP / TCP 47.94.251.227:8280 > 172.29.27.102:6193 PA / Raw
Ether / IP / TCP 47.94.251.227:8280 > 172.29.27.102:6193 PA / Raw
Ether / IP / TCP 47.94.251.227:8280 > 172.29.27.102:6193 PA / Raw
Ether / IP / TCP 47.94.251.227:8280 > 172.29.27.102:6193 PA / Raw
Ether / IP / TCP 47.94.251.227:8280 > 172.29.27.102:6193 PA / Raw
Ether / IP / TCP 47.94.251.227:8280 > 172.29.27.102:6193 PA / Raw
Ether / IP / TCP 47.94.251.227:8280 > 172.29.27.102:6193 PA / Raw
Ether / IP / TCP 47.94.251.227:8280 > 172.29.27.102:6193 PA / Raw
Ether / IP / TCP 47.94.251.227:8280 > 172.29.27.102:6193 PA / Raw
Ether / IP / TCP 47.94.251.227:8280 > 172.29.27.102:6193 PA / Raw
Ether / IP / TCP 47.94.251.227:8280 > 172.29.27.102:6193 PA / Raw
Ether / IP / TCP 47.94.251.227:8280 > 172.29.27.102:6193 PA / Raw
Ether / IP / TCP 47.94.251.227:8280 > 172.29.27.102:6193 PA / Raw
Ether / IP / TCP 47.94.251.227:8280 > 172.29.27.102:6193 PA / Raw
Ether / IP / TCP 47.94.251.227:8280 > 172.29.27.102:6193 PA / Raw
Ether / IP / TCP 47.94.251.227:8280 > 172.29.27.102:6193 PA / Raw
Ether / IP / TCP 47.94.251.227:8280 > 172.29.27.102:6193 PA / Raw
Ether / IP / TCP 47.94.251.227:8280 > 172.29.27.102:6193 PA / Raw
Ether / IP / TCP 47.94.251.227:8280 > 172.29.27.102:6193 PA / Raw
Ether / IP / TCP 47.94.251.227:8280 > 172.29.27.102:6193 PA / Raw
Ether / IP / TCP 47.94.251.227:8280 > 172.29.27.102:6193 PA / Raw
Ether / IP / TCP 47.94.251.227:8280 > 172.29.27.102:6193 PA / Raw
Ether / IP / TCP 47.94.251.227:8280 > 172.29.27.102:6193 PA / Raw
Ether / IP / TCP 47.94.251.227:8280 > 172.29.27.102:6193 PA / Raw
Ether / IP / TCP 47.94.251.227:8280 > 172.29.27.102:6193 PA / Raw
Ether / IP / TCP 47.94.251.227:8280 > 172.29.27.102:6193 PA / Raw
Ether / IP / TCP 47.94.251.227:8280 > 172.29.27.102:6193 PA / Raw
Ether / IP / TCP 47.94.251.227:8280 > 172.29.27.102:6193 PA / Raw
Ether / IP / TCP 47.94.251.227:8280 > 172.29.27.102:6193 PA / Raw
Ether / IP / TCP 47.94.251.227:8280 > 172.29.27.102:6193 PA / Raw
Ether / IP / TCP 47.94.251.227:8280 > 172.29.27.102:6193 PA / Raw
Ether / IP / TCP 47.94.251.227:8280 > 172.29.27.102:6193 PA / Raw
Ether / IP / TCP 47.94.251.227:8280 > 172.29.27.102:6193 PA / Raw
Ether / IP / TCP 47.94.251.227:8280 > 172.29.27.102:6193 PA / Raw
Ether / IP / TCP 47.94.251.227:8280 > 172.29.27.102:6193 PA / Raw
Ether / IP / TCP 47.94.251.227:8280 > 172.29.27.102:6193 PA / Raw
Ether / IP / TCP 47.94.251.227:8280 > 172.29.27.102:6193 PA / Raw
Ether / IP / TCP 47.94.251.227:8280 > 172.29.27.102:6193 PA / Raw
Ether / IP / TCP 47.94.251.227:8280 > 172.29.27.102:6193 PA / Raw
Ether / IP / TCP 47.94.251.227:8280 > 172.29.27.102:6193 PA / Raw
Ether / IP / TCP 47.94.251.227:8280 > 172.29.27.102:6193 PA / Raw
Ether / IP / TCP 47.94.251.227:8280 > 172.29.27.102:6193 PA / Raw
Ether / IP / TCP 47.94.251.227:8280 > 172.29.27.102:6193 PA / Raw
Ether / IP / TCP 47.94.251.227:8280 > 172.29.27.102:6193 PA / Raw
Ether / IP / TCP 47.94.251.227:8280 > 172.29.27.102:6193 PA / Raw
Ether / IP / TCP 47.94.251.227:8280 > 172.29.27.102:6193 PA / Raw
Ether / IP / TCP 47.94.251.227:8280 > 172.29.27.102:6193 PA / Raw
Ether / IP / TCP 47.94.251.227:8280 > 172.29.27.102:6193 PA / Raw
Ether / IP / TCP 47.94.251.227:8280 > 172.29.27.102:6193 PA / Raw
Ether / IP / TCP 47.94.251.227:8280 > 172.29.27.102:6193 PA / Raw
Ether / IP / TCP 47.94.251.227:8280 > 172.29.27.102:6193 PA / Raw
Ether / IP / TCP 47.94.251.227:8280 > 172.29.27.102:6193 PA / Raw
Ether / IP / TCP 47.94.251.227:8280 > 172.29.27.102:6193 PA / Raw
Ether / IP / TCP 47.94.251.227:8280 > 172.29.27.102:6193 PA / Raw
Ether / IP / TCP 47.94.251.227:8280 > 172.29.27.102:6193 PA / Raw
Ether / IP / TCP 47.94.251.227:8280 > 172.29.27.102:6193 PA / Raw
Ether / IP / TCP 47.94.251.227:8280 > 172.29.27.102:6193 PA / Raw
Ether / IP / TCP 47.94.251.227:8280 > 172.29.27.102:6193 PA / Raw
Ether / IP / TCP 47.94.251.227:8280 > 172.29.27.102:6193 PA / Raw
Ether / IP / TCP 47.94.251.227:8280 > 172.29.27.102:6193 PA / Raw
Ether / IP / TCP 47.94.251.227:8280 > 172.29.27.102:6193 PA / Raw
Ether / IP / TCP 47.94.251.227:8280 > 172.29.27.102:6193 PA / Raw
Ether / IP / TCP 47.94.251.227:8280 > 172.29.27.102:6193 PA / Raw
Ether / IP / TCP 47.94.251.227:8280 > 172.29.27.102:6193 PA / Raw
Ether / IP / TCP 47.94.251.227:8280 > 172.29.27.102:6193 PA / Raw
Ether / IP / TCP 47.94.251.227:8280 > 172.29.27.102:6193 PA / Raw
Ether / IP / TCP 47.94.251.227:8280 > 172.29.27.102:6193 PA / Raw
Ether / IP / TCP 47.94.251.227:8280 > 172.29.27.102:6193 PA / Raw
Ether / IP / TCP 47.94.251.227:8280 > 172.29.27.102:6193 PA / Raw
Ether / IP / TCP 47.94.251.227:8280 > 172.29.27.102:6193 PA / Raw
Ether / IP / TCP 47.94.251.227:8280 > 172.29.27.102:6193 PA / Raw
Ether / IP / TCP 47.94.251.227:8280 > 172.29.27.102:6193 PA / Raw
Ether / IP / TCP 47.94.251.227:8280 > 172.29.27.102:6193 PA / Raw
Ether / IP / TCP 47.94.251.227:8280 > 172.29.27.102:6193 PA / Raw
Ether / IP / TCP 47.94.251.227:8280 > 172.29.27.102:6193 PA / Raw
Ether / IP / TCP 47.94.251.227:8280 > 172.29.27.102:6193 PA / Raw
Ether / IP / TCP 47.94.251.227:8280 > 172.29.27.102:6193 PA / Raw
Ether / IP / TCP 47.94.251.227:8280 > 172.29.27.102:6193 PA / Raw
Ether / IP / TCP 47.94.251.227:8280 > 172.29.27.102:6193 PA / Raw
Ether / IP / TCP 47.94.251.227:8280 > 172.29.27.102:6193 PA / Raw
Ether / IP / TCP 47.94.251.227:8280 > 172.29.27.102:6193 PA / Raw
Ether / IP / TCP 47.94.251.227:8280 > 172.29.27.102:6193 PA / Raw
Ether / IP / TCP 47.94.251.227:8280 > 172.29.27.102:6193 PA / Raw
Ether / IP / TCP 47.94.251.227:8280 > 172.29.27.102:6193 PA / Raw
Ether / IP / TCP 47.94.251.227:8280 > 172.29.27.102:6193 PA / Raw
Ether / IP / TCP 47.94.251.227:8280 > 172.29.27.102:6193 PA / Raw
Ether / IP / TCP 47.94.251.227:8280 > 172.29.27.102:6193 PA / Raw
Ether / IP / TCP 47.94.251.227:8280 > 172.29.27.102:6193 PA / Raw
Ether / IP / TCP 47.94.251.227:8280 > 172.29.27.102:6193 PA / Raw
Ether / IP / TCP 47.94.251.227:8280 > 172.29.27.102:6193 PA / Raw
Ether / IP / TCP 47.94.251.227:8280 > 172.29.27.102:6193 PA / Raw
Ether / IP / TCP 47.94.251.227:8280 > 172.29.27.102:6193 PA / Raw
Ether / IP / TCP 47.94.251.227:8280 > 172.29.27.102:6193 PA / Raw
Ether / IP / TCP 47.94.251.227:8280 > 172.29.27.102:6193 PA / Raw
Ether / IP / TCP 47.94.251.227:8280 > 172.29.27.102:6193 PA / Raw
Ether / IP / TCP 47.94.251.227:8280 > 172.29.27.102:6193 PA / Raw
Ether / IP / TCP 47.94.251.227:8280 > 172.29.27.102:6193 PA / Raw
Ether / IP / TCP 47.94.251.227:8280 > 172.29.27.102:6193 PA / Raw
Ether / IP / TCP 47.94.251.227:8280 > 172.29.27.102:6193 PA / Raw
Ether / IP / TCP 47.94.251.227:8280 > 172.29.27.102:6193 PA / Raw
Ether / IP / TCP 47.94.251.227:8280 > 172.29.27.102:6193 PA / Raw
Ether / IP / TCP 47.94.251.227:8280 > 172.29.27.102:6193 PA / Raw
Ether / IP / TCP 47.94.251.227:8280 > 172.29.27.102:6193 PA / Raw
Ether / IP / TCP 47.94.251.227:8280 > 172.29.27.102:6193 PA / Raw
Ether / IP / TCP 47.94.251.227:8280 > 172.29.27.102:6193 PA / Raw
Ether / IP / TCP 47.94.251.227:8280 > 172.29.27.102:6193 PA / Raw
Ether / IP / TCP 47.94.251.227:8280 > 172.29.27.102:6193 PA / Raw
Ether / IP / TCP 47.94.251.227:8280 > 172.29.27.102:6193 PA / Raw
Ether / IP / TCP 47.94.251.227:8280 > 172.29.27.102:6193 PA / Raw
Ether / IP / TCP 47.94.251.227:8280 > 172.29.27.102:6193 PA / Raw
Ether / IP / TCP 47.94.251.227:8280 > 172.29.27.102:6193 PA / Raw
Ether / IP / TCP 47.94.251.227:8280 > 172.29.27.102:6193 PA / Raw
Ether / IP / TCP 47.94.251.227:8280 > 172.29.27.102:6193 PA / Raw
Ether / IP / TCP 47.94.251.227:8280 > 172.29.27.102:6193 PA / Raw
Ether / IP / TCP 47.94.251.227:8280 > 172.29.27.102:6193 PA / Raw
Ether / IP / TCP 47.94.251.227:8280 > 172.29.27.102:6193 PA / Raw
Ether / IP / TCP 47.94.251.227:8280 > 172.29.27.102:6193 PA / Raw
Ether / IP / TCP 47.94.251.227:8280 > 172.29.27.102:6193 PA / Raw
Ether / IP / TCP 47.94.251.227:8280 > 172.29.27.102:6193 PA / Raw
Ether / IP / TCP 47.94.251.227:8280 > 172.29.27.102:6193 PA / Raw
Ether / IP / TCP 47.94.251.227:8280 > 172.29.27.102:6193 PA / Raw
Ether / IP / TCP 47.94.251.227:8280 > 172.29.27.102:6193 PA / Raw
Ether / IP / TCP 47.94.251.227:8280 > 172.29.27.102:6193 PA / Raw
Ether / IP / TCP 47.94.251.227:8280 > 172.29.27.102:6193 PA / Raw
Ether / IP / TCP 47.94.251.227:8280 > 172.29.27.102:6193 PA / Raw
Ether / IP / TCP 47.94.251.227:8280 > 172.29.27.102:6193 PA / Raw
Ether / IP / TCP 47.94.251.227:8280 > 172.29.27.102:6193 PA / Raw
Ether / IP / TCP 47.94.251.227:8280 > 172.29.27.102:6193 PA / Raw
Ether / IP / TCP 47.94.251.227:8280 > 172.29.27.102:6193 PA / Raw
Ether / IP / TCP 47.94.251.227:8280 > 172.29.27.102:6193 PA / Raw
Ether / IP / TCP 47.94.251.227:8280 > 172.29.27.102:6193 PA / Raw
Ether / IP / TCP 47.94.251.227:8280 > 172.29.27.102:6193 PA / Raw
Ether / IP / TCP 47.94.251.227:8280 > 172.29.27.102:6193 PA / Raw
Ether / IP / TCP 47.94.251.227:8280 > 172.29.27.102:6193 PA / Raw
Ether / IP / TCP 47.94.251.227:8280 > 172.29.27.102:6193 PA / Raw
Ether / IP / TCP 47.94.251.227:8280 > 172.29.27.102:6193 PA / Raw
Ether / IP / TCP 47.94.251.227:8280 > 172.29.27.102:6193 PA / Raw
Ether / IP / TCP 47.94.251.227:8280 > 172.29.27.102:6193 PA / Raw
Ether / IP / TCP 47.94.251.227:8280 > 172.29.27.102:6193 PA / Raw
Ether / IP / TCP 47.94.251.227:8280 > 172.29.27.102:6193 PA / Raw
Ether / IP / TCP 47.94.251.227:8280 > 172.29.27.102:6193 PA / Raw
Ether / IP / TCP 47.94.251.227:8280 > 172.29.27.102:6193 PA / Raw
Ether / IP / TCP 47.94.251.227:8280 > 172.29.27.102:6193 PA / Raw
Ether / IP / TCP 47.94.251.227:8280 > 172.29.27.102:6193 PA / Raw
Ether / IP / TCP 47.94.251.227:8280 > 172.29.27.102:6193 PA / Raw
Ether / IP / TCP 47.94.251.227:8280 > 172.29.27.102:6193 PA / Raw
Ether / IP / TCP 47.94.251.227:8280 > 172.29.27.102:6193 PA / Raw
Ether / IP / TCP 47.94.251.227:8280 > 172.29.27.102:6193 PA / Raw
Ether / IP / TCP 47.94.251.227:8280 > 172.29.27.102:6193 PA / Raw
Ether / IP / TCP 47.94.251.227:8280 > 172.29.27.102:6193 PA / Raw
Ether / IP / TCP 47.94.251.227:8280 > 172.29.27.102:6193 PA / Raw
Ether / IP / TCP 47.94.251.227:8280 > 172.29.27.102:6193 PA / Raw
Ether / IP / TCP 47.94.251.227:8280 > 172.29.27.102:6193 PA / Raw
Ether / IP / TCP 47.94.251.227:8280 > 172.29.27.102:6193 PA / Raw
Ether / IP / TCP 47.94.251.227:8280 > 172.29.27.102:6193 PA / Raw
Ether / IP / TCP 47.94.251.227:8280 > 172.29.27.102:6193 PA / Raw
Ether / IP / TCP 47.94.251.227:8280 > 172.29.27.102:6193 PA / Raw
Ether / IP / TCP 47.94.251.227:8280 > 172.29.27.102:6193 PA / Raw
Ether / IP / TCP 47.94.251.227:8280 > 172.29.27.102:6193 PA / Raw
Ether / IP / TCP 47.94.251.227:8280 > 172.29.27.102:6193 PA / Raw
Ether / IP / TCP 47.94.251.227:8280 > 172.29.27.102:6193 PA / Raw
Ether / IP / TCP 47.94.251.227:8280 > 172.29.27.102:6193 PA / Raw
Ether / IP / TCP 47.94.251.227:8280 > 172.29.27.102:6193 PA / Raw
Ether / IP / TCP 47.94.251.227:8280 > 172.29.27.102:6193 PA / Raw
Ether / IP / TCP 47.94.251.227:8280 > 172.29.27.102:6193 PA / Raw
Ether / IP / TCP 47.94.251.227:8280 > 172.29.27.102:6193 PA / Raw
Ether / IP / TCP 47.94.251.227:8280 > 172.29.27.102:6193 PA / Raw
Ether / IP / TCP 47.94.251.227:8280 > 172.29.27.102:6193 PA / Raw
Ether / IP / TCP 47.94.251.227:8280 > 172.29.27.102:6193 PA / Raw
Ether / IP / TCP 47.94.251.227:8280 > 172.29.27.102:6193 PA / Raw
Ether / IP / TCP 47.94.251.227:8280 > 172.29.27.102:6193 PA / Raw
Ether / IP / TCP 47.94.251.227:8280 > 172.29.27.102:6193 PA / Raw
Ether / IP / TCP 47.94.251.227:8280 > 172.29.27.102:6193 PA / Raw
Ether / IP / TCP 47.94.251.227:8280 > 172.29.27.102:6193 PA / Raw
Ether / IP / TCP 47.94.251.227:8280 > 172.29.27.102:6193 PA / Raw
Ether / IP / TCP 47.94.251.227:8280 > 172.29.27.102:6193 PA / Raw
Ether / IP / TCP 47.94.251.227:8280 > 172.29.27.102:6193 PA / Raw
Ether / IP / TCP 47.94.251.227:8280 > 172.29.27.102:6193 PA / Raw
Ether / IP / TCP 47.94.251.227:8280 > 172.29.27.102:6193 PA / Raw
Ether / IP / TCP 47.94.251.227:8280 > 172.29.27.102:6193 PA / Raw
Ether / IP / TCP 47.94.251.227:8280 > 172.29.27.102:6193 PA / Raw
Ether / IP / TCP 47.94.251.227:8280 > 172.29.27.102:6193 PA / Raw
Ether / IP / TCP 47.94.251.227:8280 > 172.29.27.102:6193 PA / Raw
Ether / IP / TCP 47.94.251.227:8280 > 172.29.27.102:6193 PA / Raw
Ether / IP / TCP 47.94.251.227:8280 > 172.29.27.102:6193 PA / Raw
Ether / IP / TCP 47.94.251.227:8280 > 172.29.27.102:6193 PA / Raw
Ether / IP / TCP 47.94.251.227:8280 > 172.29.27.102:6193 PA / Raw
Ether / IP / TCP 47.94.251.227:8280 > 172.29.27.102:6193 PA / Raw
Ether / IP / TCP 47.94.251.227:8280 > 172.29.27.102:6193 PA / Raw
Ether / IP / TCP 47.94.251.227:8280 > 172.29.27.102:6193 PA / Raw
Ether / IP / TCP 47.94.251.227:8280 > 172.29.27.102:6193 PA / Raw
Ether / IP / TCP 47.94.251.227:8280 > 172.29.27.102:6193 PA / Raw
Ether / IP / TCP 47.94.251.227:8280 > 172.29.27.102:6193 PA / Raw
Ether / IP / TCP 47.94.251.227:8280 > 172.29.27.102:6193 PA / Raw
Ether / IP / TCP 47.94.251.227:8280 > 172.29.27.102:6193 PA / Raw
Ether / IP / TCP 47.94.251.227:8280 > 172.29.27.102:6193 PA / Raw
Ether / IP / TCP 47.94.251.227:8280 > 172.29.27.102:6193 PA / Raw
Ether / IP / TCP 47.94.251.227:8280 > 172.29.27.102:6193 PA / Raw
Ether / IP / TCP 47.94.251.227:8280 > 172.29.27.102:6193 PA / Raw
Ether / IP / TCP 47.94.251.227:8280 > 172.29.27.102:6193 PA / Raw
Ether / IP / TCP 47.94.251.227:8280 > 172.29.27.102:6193 PA / Raw
Ether / IP / TCP 47.94.251.227:8280 > 172.29.27.102:6193 PA / Raw
Ether / IP / TCP 47.94.251.227:8280 > 172.29.27.102:6193 PA / Raw
Ether / IP / TCP 47.94.251.227:8280 > 172.29.27.102:6193 PA / Raw
Ether / IP / TCP 47.94.251.227:8280 > 172.29.27.102:6193 PA / Raw
Ether / IP / TCP 47.94.251.227:8280 > 172.29.27.102:6193 PA / Raw
Ether / IP / TCP 47.94.251.227:8280 > 172.29.27.102:6193 PA / Raw
Ether / IP / TCP 47.94.251.227:8280 > 172.29.27.102:6193 PA / Raw
Ether / IP / TCP 47.94.251.227:8280 > 172.29.27.102:6193 PA / Raw
Ether / IP / TCP 47.94.251.227:8280 > 172.29.27.102:6193 PA / Raw
Ether / IP / TCP 47.94.251.227:8280 > 172.29.27.102:6193 PA / Raw
Ether / IP / TCP 47.94.251.227:8280 > 172.29.27.102:6193 PA / Raw
Ether / IP / TCP 47.94.251.227:8280 > 172.29.27.102:6193 PA / Raw
Ether / IP / TCP 47.94.251.227:8280 > 172.29.27.102:6193 PA / Raw
Ether / IP / TCP 47.94.251.227:8280 > 172.29.27.102:6193 PA / Raw
Ether / IP / TCP 47.94.251.227:8280 > 172.29.27.102:6193 PA / Raw
Ether / IP / TCP 47.94.251.227:8280 > 172.29.27.102:6193 PA / Raw
Ether / IP / TCP 47.94.251.227:8280 > 172.29.27.102:6193 PA / Raw
Ether / IP / TCP 47.94.251.227:8280 > 172.29.27.102:6193 PA / Raw
Ether / IP / TCP 47.94.251.227:8280 > 172.29.27.102:6193 PA / Raw
Ether / IP / TCP 47.94.251.227:8280 > 172.29.27.102:6193 PA / Raw
Ether / IP / TCP 47.94.251.227:8280 > 172.29.27.102:6193 PA / Raw
Ether / IP / TCP 47.94.251.227:8280 > 172.29.27.102:6193 PA / Raw
Ether / IP / TCP 47.94.251.227:8280 > 172.29.27.102:6193 PA / Raw
Ether / IP / TCP 47.94.251.227:8280 > 172.29.27.102:6193 PA / Raw
Ether / IP / TCP 47.94.251.227:8280 > 172.29.27.102:6193 PA / Raw
Ether / IP / TCP 47.94.251.227:8280 > 172.29.27.102:6193 PA / Raw
Ether / IP / TCP 47.94.251.227:8280 > 172.29.27.102:6193 PA / Raw
Ether / IP / TCP 47.94.251.227:8280 > 172.29.27.102:6193 PA / Raw
Ether / IP / TCP 47.94.251.227:8280 > 172.29.27.102:6193 PA / Raw
Ether / IP / TCP 47.94.251.227:8280 > 172.29.27.102:6193 PA / Raw
Ether / IP / TCP 47.94.251.227:8280 > 172.29.27.102:6193 PA / Raw
Ether / IP / TCP 47.94.251.227:8280 > 172.29.27.102:6193 PA / Raw
Ether / IP / TCP 47.94.251.227:8280 > 172.29.27.102:6193 PA / Raw
Ether / IP / TCP 47.94.251.227:8280 > 172.29.27.102:6193 PA / Raw
Ether / IP / TCP 47.94.251.227:8280 > 172.29.27.102:6193 PA / Raw
Ether / IP / TCP 47.94.251.227:8280 > 172.29.27.102:6193 PA / Raw
Ether / IP / TCP 47.94.251.227:8280 > 172.29.27.102:6193 PA / Raw
Ether / IP / TCP 47.94.251.227:8280 > 172.29.27.102:6193 PA / Raw
Ether / IP / TCP 47.94.251.227:8280 > 172.29.27.102:6193 PA / Raw
Ether / IP / TCP 47.94.251.227:8280 > 172.29.27.102:6193 PA / Raw
Ether / IP / TCP 47.94.251.227:8280 > 172.29.27.102:6193 PA / Raw
Ether / IP / TCP 47.94.251.227:8280 > 172.29.27.102:6193 PA / Raw
Ether / IP / TCP 47.94.251.227:8280 > 172.29.27.102:6193 PA / Raw
Ether / IP / TCP 47.94.251.227:8280 > 172.29.27.102:6193 PA / Raw
Ether / IP / TCP 47.94.251.227:8280 > 172.29.27.102:6193 PA / Raw
Ether / IP / TCP 47.94.251.227:8280 > 172.29.27.102:6193 PA / Raw
Ether / IP / TCP 47.94.251.227:8280 > 172.29.27.102:6193 PA / Raw
Ether / IP / TCP 47.94.251.227:8280 > 172.29.27.102:6193 PA / Raw
Ether / IP / TCP 47.94.251.227:8280 > 172.29.27.102:6193 PA / Raw
Ether / IP / TCP 47.94.251.227:8280 > 172.29.27.102:6193 PA / Raw
Ether / IP / TCP 47.94.251.227:8280 > 172.29.27.102:6193 PA / Raw
Ether / IP / TCP 47.94.251.227:8280 > 172.29.27.102:6193 PA / Raw
Ether / IP / TCP 47.94.251.227:8280 > 172.29.27.102:6193 PA / Raw
Ether / IP / TCP 47.94.251.227:8280 > 172.29.27.102:6193 PA / Raw
Ether / IP / TCP 47.94.251.227:8280 > 172.29.27.102:6193 PA / Raw
Ether / IP / TCP 47.94.251.227:8280 > 172.29.27.102:6193 PA / Raw
Ether / IP / TCP 47.94.251.227:8280 > 172.29.27.102:6193 PA / Raw
Ether / IP / TCP 47.94.251.227:8280 > 172.29.27.102:6193 PA / Raw
Ether / IP / TCP 47.94.251.227:8280 > 172.29.27.102:6193 PA / Raw
Ether / IP / TCP 47.94.251.227:8280 > 172.29.27.102:6193 PA / Raw
Ether / IP / TCP 47.94.251.227:8280 > 172.29.27.102:6193 PA / Raw
Ether / IP / TCP 47.94.251.227:8280 > 172.29.27.102:6193 PA / Raw
Ether / IP / TCP 47.94.251.227:8280 > 172.29.27.102:6193 PA / Raw
Ether / IP / TCP 47.94.251.227:8280 > 172.29.27.102:6193 PA / Raw
Ether / IP / TCP 47.94.251.227:8280 > 172.29.27.102:6193 PA / Raw
Ether / IP / TCP 47.94.251.227:8280 > 172.29.27.102:6193 PA / Raw
Ether / IP / TCP 47.94.251.227:8280 > 172.29.27.102:6193 PA / Raw
Ether / IP / TCP 47.94.251.227:8280 > 172.29.27.102:6193 PA / Raw
Ether / IP / TCP 47.94.251.227:8280 > 172.29.27.102:6193 PA / Raw
Ether / IP / TCP 47.94.251.227:8280 > 172.29.27.102:6193 PA / Raw
Ether / IP / TCP 47.94.251.227:8280 > 172.29.27.102:6193 PA / Raw
Ether / IP / TCP 47.94.251.227:8280 > 172.29.27.102:6193 PA / Raw
Ether / IP / TCP 47.94.251.227:8280 > 172.29.27.102:6193 PA / Raw
Ether / IP / TCP 47.94.251.227:8280 > 172.29.27.102:6193 PA / Raw
Ether / IP / TCP 47.94.251.227:8280 > 172.29.27.102:6193 PA / Raw
Ether / IP / TCP 47.94.251.227:8280 > 172.29.27.102:6193 PA / Raw
Ether / IP / TCP 47.94.251.227:8280 > 172.29.27.102:6193 PA / Raw
Ether / IP / TCP 47.94.251.227:8280 > 172.29.27.102:6193 PA / Raw
Ether / IP / TCP 47.94.251.227:8280 > 172.29.27.102:6193 PA / Raw
Ether / IP / TCP 47.94.251.227:8280 > 172.29.27.102:6193 PA / Raw
Ether / IP / TCP 47.94.251.227:8280 > 172.29.27.102:6193 PA / Raw
Ether / IP / TCP 47.94.251.227:8280 > 172.29.27.102:6193 PA / Raw
Ether / IP / TCP 47.94.251.227:8280 > 172.29.27.102:6193 PA / Raw
Ether / IP / TCP 47.94.251.227:8280 > 172.29.27.102:6193 PA / Raw
Ether / IP / TCP 47.94.251.227:8280 > 172.29.27.102:6193 PA / Raw
Ether / IP / TCP 47.94.251.227:8280 > 172.29.27.102:6193 PA / Raw
Ether / IP / TCP 47.94.251.227:8280 > 172.29.27.102:6193 PA / Raw
Ether / IP / TCP 47.94.251.227:8280 > 172.29.27.102:6193 PA / Raw
Ether / IP / TCP 47.94.251.227:8280 > 172.29.27.102:6193 PA / Raw
Ether / IP / TCP 47.94.251.227:8280 > 172.29.27.102:6193 PA / Raw
Ether / IP / TCP 47.94.251.227:8280 > 172.29.27.102:6193 PA / Raw
Ether / IP / TCP 47.94.251.227:8280 > 172.29.27.102:6193 PA / Raw
Ether / IP / TCP 47.94.251.227:8280 > 172.29.27.102:6193 PA / Raw
Ether / IP / TCP 47.94.251.227:8280 > 172.29.27.102:6193 PA / Raw
Ether / IP / TCP 47.94.251.227:8280 > 172.29.27.102:6193 PA / Raw
Ether / IP / TCP 47.94.251.227:8280 > 172.29.27.102:6193 PA / Raw
Ether / IP / TCP 47.94.251.227:8280 > 172.29.27.102:6193 PA / Raw
Ether / IP / TCP 47.94.251.227:8280 > 172.29.27.102:6193 PA / Raw
Ether / IP / TCP 47.94.251.227:8280 > 172.29.27.102:6193 PA / Raw
Ether / IP / TCP 47.94.251.227:8280 > 172.29.27.102:6193 PA / Raw
Ether / IP / TCP 47.94.251.227:8280 > 172.29.27.102:6193 PA / Raw
Ether / IP / TCP 47.94.251.227:8280 > 172.29.27.102:6193 PA / Raw
Ether / IP / TCP 47.94.251.227:8280 > 172.29.27.102:6193 PA / Raw
Ether / IP / TCP 47.94.251.227:8280 > 172.29.27.102:6193 PA / Raw
Ether / IP / TCP 47.94.251.227:8280 > 172.29.27.102:6193 PA / Raw
Ether / IP / TCP 47.94.251.227:8280 > 172.29.27.102:6193 PA / Raw
Ether / IP / TCP 47.94.251.227:8280 > 172.29.27.102:6193 PA / Raw
Ether / IP / TCP 47.94.251.227:8280 > 172.29.27.102:6193 PA / Raw
Ether / IP / TCP 47.94.251.227:8280 > 172.29.27.102:6193 PA / Raw
Ether / IP / TCP 47.94.251.227:8280 > 172.29.27.102:6193 PA / Raw
Ether / IP / TCP 47.94.251.227:8280 > 172.29.27.102:6193 PA / Raw
Ether / IP / TCP 47.94.251.227:8280 > 172.29.27.102:6193 PA / Raw
Ether / IP / TCP 47.94.251.227:8280 > 172.29.27.102:6193 PA / Raw
Ether / IP / TCP 47.94.251.227:8280 > 172.29.27.102:6193 PA / Raw
Ether / IP / TCP 47.94.251.227:8280 > 172.29.27.102:6193 PA / Raw
Ether / IP / TCP 47.94.251.227:8280 > 172.29.27.102:6193 PA / Raw
Ether / IP / TCP 47.94.251.227:8280 > 172.29.27.102:6193 PA / Raw
Ether / IP / TCP 47.94.251.227:8280 > 172.29.27.102:6193 PA / Raw
Ether / IP / TCP 47.94.251.227:8280 > 172.29.27.102:6193 PA / Raw
Ether / IP / TCP 47.94.251.227:8280 > 172.29.27.102:6193 PA / Raw
Ether / IP / TCP 47.94.251.227:8280 > 172.29.27.102:6193 PA / Raw
Ether / IP / TCP 47.94.251.227:8280 > 172.29.27.102:6193 PA / Raw
Ether / IP / TCP 47.94.251.227:8280 > 172.29.27.102:6193 PA / Raw
Ether / IP / TCP 47.94.251.227:8280 > 172.29.27.102:6193 PA / Raw
Ether / IP / TCP 47.94.251.227:8280 > 172.29.27.102:6193 PA / Raw
Ether / IP / TCP 47.94.251.227:8280 > 172.29.27.102:6193 PA / Raw
Ether / IP / TCP 47.94.251.227:8280 > 172.29.27.102:6193 PA / Raw
Ether / IP / TCP 47.94.251.227:8280 > 172.29.27.102:6193 PA / Raw
Ether / IP / TCP 47.94.251.227:8280 > 172.29.27.102:6193 PA / Raw
Ether / IP / TCP 47.94.251.227:8280 > 172.29.27.102:6193 PA / Raw
Ether / IP / TCP 47.94.251.227:8280 > 172.29.27.102:6193 PA / Raw
Ether / IP / TCP 47.94.251.227:8280 > 172.29.27.102:6193 PA / Raw
Ether / IP / TCP 47.94.251.227:8280 > 172.29.27.102:6193 PA / Raw
Ether / IP / TCP 47.94.251.227:8280 > 172.29.27.102:6193 PA / Raw
Ether / IP / TCP 47.94.251.227:8280 > 172.29.27.102:6193 PA / Raw
Ether / IP / TCP 47.94.251.227:8280 > 172.29.27.102:6193 PA / Raw
Ether / IP / TCP 47.94.251.227:8280 > 172.29.27.102:6193 PA / Raw
Ether / IP / TCP 47.94.251.227:8280 > 172.29.27.102:6193 PA / Raw
Ether / IP / TCP 47.94.251.227:8280 > 172.29.27.102:6193 PA / Raw
Ether / IP / TCP 47.94.251.227:8280 > 172.29.27.102:6193 PA / Raw
Ether / IP / TCP 47.94.251.227:8280 > 172.29.27.102:6193 PA / Raw
Ether / IP / TCP 47.94.251.227:8280 > 172.29.27.102:6193 PA / Raw
Ether / IP / TCP 47.94.251.227:8280 > 172.29.27.102:6193 PA / Raw
Ether / IP / TCP 47.94.251.227:8280 > 172.29.27.102:6193 PA / Raw
Ether / IP / TCP 47.94.251.227:8280 > 172.29.27.102:6193 PA / Raw
Ether / IP / TCP 47.94.251.227:8280 > 172.29.27.102:6193 PA / Raw
Ether / IP / TCP 47.94.251.227:8280 > 172.29.27.102:6193 PA / Raw
Ether / IP / TCP 47.94.251.227:8280 > 172.29.27.102:6193 PA / Raw
Ether / IP / TCP 47.94.251.227:8280 > 172.29.27.102:6193 PA / Raw
Ether / IP / TCP 47.94.251.227:8280 > 172.29.27.102:6193 PA / Raw
Ether / IP / TCP 47.94.251.227:8280 > 172.29.27.102:6193 PA / Raw
Ether / IP / TCP 47.94.251.227:8280 > 172.29.27.102:6193 PA / Raw
Ether / IP / TCP 47.94.251.227:8280 > 172.29.27.102:6193 PA / Raw
Ether / IP / TCP 47.94.251.227:8280 > 172.29.27.102:6193 PA / Raw
Ether / IP / TCP 47.94.251.227:8280 > 172.29.27.102:6193 PA / Raw
Ether / IP / TCP 47.94.251.227:8280 > 172.29.27.102:6193 PA / Raw
Ether / IP / TCP 47.94.251.227:8280 > 172.29.27.102:6193 PA / Raw
Ether / IP / TCP 47.94.251.227:8280 > 172.29.27.102:6193 PA / Raw
Ether / IP / TCP 47.94.251.227:8280 > 172.29.27.102:6193 PA / Raw
Ether / IP / TCP 47.94.251.227:8280 > 172.29.27.102:6193 PA / Raw
Ether / IP / TCP 47.94.251.227:8280 > 172.29.27.102:6193 PA / Raw
Ether / IP / TCP 47.94.251.227:8280 > 172.29.27.102:6193 PA / Raw
Ether / IP / TCP 47.94.251.227:8280 > 172.29.27.102:6193 PA / Raw
Ether / IP / TCP 47.94.251.227:8280 > 172.29.27.102:6193 PA / Raw
Ether / IP / TCP 47.94.251.227:8280 > 172.29.27.102:6193 PA / Raw
Ether / IP / TCP 47.94.251.227:8280 > 172.29.27.102:6193 PA / Raw
Ether / IP / TCP 47.94.251.227:8280 > 172.29.27.102:6193 PA / Raw
Ether / IP / TCP 47.94.251.227:8280 > 172.29.27.102:6193 PA / Raw
Ether / IP / TCP 47.94.251.227:8280 > 172.29.27.102:6193 PA / Raw
Ether / IP / TCP 47.94.251.227:8280 > 172.29.27.102:6193 PA / Raw
Ether / IP / TCP 47.94.251.227:8280 > 172.29.27.102:6193 PA / Raw
Ether / IP / TCP 47.94.251.227:8280 > 172.29.27.102:6193 PA / Raw
Ether / IP / TCP 47.94.251.227:8280 > 172.29.27.102:6193 PA / Raw
Ether / IP / TCP 47.94.251.227:8280 > 172.29.27.102:6193 PA / Raw
Ether / IP / TCP 47.94.251.227:8280 > 172.29.27.102:6193 PA / Raw
Ether / IP / TCP 47.94.251.227:8280 > 172.29.27.102:6193 PA / Raw
Ether / IP / TCP 47.94.251.227:8280 > 172.29.27.102:6193 PA / Raw
Ether / IP / TCP 47.94.251.227:8280 > 172.29.27.102:6193 PA / Raw
Ether / IP / TCP 47.94.251.227:8280 > 172.29.27.102:6193 PA / Raw
Ether / IP / TCP 47.94.251.227:8280 > 172.29.27.102:6193 PA / Raw
Ether / IP / TCP 47.94.251.227:8280 > 172.29.27.102:6193 PA / Raw
Ether / IP / TCP 47.94.251.227:8280 > 172.29.27.102:6193 PA / Raw
Ether / IP / TCP 47.94.251.227:8280 > 172.29.27.102:6193 PA / Raw
Ether / IP / TCP 47.94.251.227:8280 > 172.29.27.102:6193 PA / Raw
Ether / IP / TCP 47.94.251.227:8280 > 172.29.27.102:6193 PA / Raw
Ether / IP / TCP 47.94.251.227:8280 > 172.29.27.102:6193 PA / Raw
Ether / IP / TCP 47.94.251.227:8280 > 172.29.27.102:6193 PA / Raw
Ether / IP / TCP 47.94.251.227:8280 > 172.29.27.102:6193 PA / Raw
Ether / IP / TCP 47.94.251.227:8280 > 172.29.27.102:6193 PA / Raw
Ether / IP / TCP 47.94.251.227:8280 > 172.29.27.102:6193 PA / Raw
Ether / IP / TCP 47.94.251.227:8280 > 172.29.27.102:6193 PA / Raw
Ether / IP / TCP 47.94.251.227:8280 > 172.29.27.102:6193 PA / Raw
Ether / IP / TCP 47.94.251.227:8280 > 172.29.27.102:6193 PA / Raw
Ether / IP / TCP 47.94.251.227:8280 > 172.29.27.102:6193 PA / Raw
Ether / IP / TCP 47.94.251.227:8280 > 172.29.27.102:6193 PA / Raw
Ether / IP / TCP 47.94.251.227:8280 > 172.29.27.102:6193 PA / Raw
Ether / IP / TCP 47.94.251.227:8280 > 172.29.27.102:6193 PA / Raw
Ether / IP / TCP 47.94.251.227:8280 > 172.29.27.102:6193 PA / Raw
Ether / IP / TCP 47.94.251.227:8280 > 172.29.27.102:6193 PA / Raw
Ether / IP / TCP 47.94.251.227:8280 > 172.29.27.102:6193 PA / Raw
Ether / IP / TCP 47.94.251.227:8280 > 172.29.27.102:6193 PA / Raw
Ether / IP / TCP 47.94.251.227:8280 > 172.29.27.102:6193 PA / Raw
Ether / IP / TCP 47.94.251.227:8280 > 172.29.27.102:6193 PA / Raw
Ether / IP / TCP 47.94.251.227:8280 > 172.29.27.102:6193 PA / Raw
Ether / IP / TCP 47.94.251.227:8280 > 172.29.27.102:6193 PA / Raw
Ether / IP / TCP 47.94.251.227:8280 > 172.29.27.102:6193 PA / Raw
Ether / IP / TCP 47.94.251.227:8280 > 172.29.27.102:6193 PA / Raw
Ether / IP / TCP 47.94.251.227:8280 > 172.29.27.102:6193 PA / Raw
Ether / IP / TCP 47.94.251.227:8280 > 172.29.27.102:6193 PA / Raw
Ether / IP / TCP 47.94.251.227:8280 > 172.29.27.102:6193 PA / Raw
Ether / IP / TCP 47.94.251.227:8280 > 172.29.27.102:6193 PA / Raw
Ether / IP / TCP 47.94.251.227:8280 > 172.29.27.102:6193 PA / Raw
Ether / IP / TCP 47.94.251.227:8280 > 172.29.27.102:6193 PA / Raw
Ether / IP / TCP 47.94.251.227:8280 > 172.29.27.102:6193 PA / Raw
Ether / IP / TCP 47.94.251.227:8280 > 172.29.27.102:6193 PA / Raw
Ether / IP / TCP 47.94.251.227:8280 > 172.29.27.102:6193 PA / Raw
Ether / IP / TCP 47.94.251.227:8280 > 172.29.27.102:6193 PA / Raw
Ether / IP / TCP 47.94.251.227:8280 > 172.29.27.102:6193 PA / Raw
Ether / IP / TCP 47.94.251.227:8280 > 172.29.27.102:6193 PA / Raw
Ether / IP / TCP 47.94.251.227:8280 > 172.29.27.102:6193 PA / Raw
Ether / IP / TCP 47.94.251.227:8280 > 172.29.27.102:6193 PA / Raw
Ether / IP / TCP 47.94.251.227:8280 > 172.29.27.102:6193 PA / Raw
Ether / IP / TCP 47.94.251.227:8280 > 172.29.27.102:6193 PA / Raw
Ether / IP / TCP 47.94.251.227:8280 > 172.29.27.102:6193 PA / Raw
Ether / IP / TCP 47.94.251.227:8280 > 172.29.27.102:6193 PA / Raw
Ether / IP / TCP 47.94.251.227:8280 > 172.29.27.102:6193 PA / Raw
Ether / IP / TCP 47.94.251.227:8280 > 172.29.27.102:6193 PA / Raw
Ether / IP / TCP 47.94.251.227:8280 > 172.29.27.102:6193 PA / Raw
Ether / IP / TCP 47.94.251.227:8280 > 172.29.27.102:6193 PA / Raw
Ether / IP / TCP 47.94.251.227:8280 > 172.29.27.102:6193 PA / Raw
Ether / IP / TCP 47.94.251.227:8280 > 172.29.27.102:6193 PA / Raw
Ether / IP / TCP 47.94.251.227:8280 > 172.29.27.102:6193 PA / Raw
Ether / IP / TCP 47.94.251.227:8280 > 172.29.27.102:6193 PA / Raw
Ether / IP / TCP 47.94.251.227:8280 > 172.29.27.102:6193 PA / Raw
Ether / IP / TCP 47.94.251.227:8280 > 172.29.27.102:6193 PA / Raw
Ether / IP / TCP 47.94.251.227:8280 > 172.29.27.102:6193 PA / Raw
Ether / IP / TCP 47.94.251.227:8280 > 172.29.27.102:6193 PA / Raw
Ether / IP / TCP 47.94.251.227:8280 > 172.29.27.102:6193 PA / Raw
Ether / IP / TCP 47.94.251.227:8280 > 172.29.27.102:6193 PA / Raw
Ether / IP / TCP 47.94.251.227:8280 > 172.29.27.102:6193 PA / Raw
Ether / IP / TCP 47.94.251.227:8280 > 172.29.27.102:6193 PA / Raw
Ether / IP / TCP 47.94.251.227:8280 > 172.29.27.102:6193 PA / Raw
Ether / IP / TCP 47.94.251.227:8280 > 172.29.27.102:6193 PA / Raw
Ether / IP / TCP 47.94.251.227:8280 > 172.29.27.102:6193 PA / Raw
Ether / IP / TCP 47.94.251.227:8280 > 172.29.27.102:6193 PA / Raw
Ether / IP / TCP 47.94.251.227:8280 > 172.29.27.102:6193 PA / Raw
Ether / IP / TCP 47.94.251.227:8280 > 172.29.27.102:6193 PA / Raw
Ether / IP / TCP 47.94.251.227:8280 > 172.29.27.102:6193 PA / Raw
Ether / IP / TCP 47.94.251.227:8280 > 172.29.27.102:6193 PA / Raw
Ether / IP / TCP 47.94.251.227:8280 > 172.29.27.102:6193 PA / Raw
Ether / IP / TCP 47.94.251.227:8280 > 172.29.27.102:6193 PA / Raw
Ether / IP / TCP 47.94.251.227:8280 > 172.29.27.102:6193 PA / Raw
Ether / IP / TCP 47.94.251.227:8280 > 172.29.27.102:6193 PA / Raw
Ether / IP / TCP 47.94.251.227:8280 > 172.29.27.102:6193 PA / Raw
Ether / IP / TCP 47.94.251.227:8280 > 172.29.27.102:6193 PA / Raw
Ether / IP / TCP 47.94.251.227:8280 > 172.29.27.102:6193 PA / Raw
Ether / IP / TCP 47.94.251.227:8280 > 172.29.27.102:6193 PA / Raw
Ether / IP / TCP 47.94.251.227:8280 > 172.29.27.102:6193 PA / Raw
Ether / IP / TCP 47.94.251.227:8280 > 172.29.27.102:6193 PA / Raw
Ether / IP / TCP 47.94.251.227:8280 > 172.29.27.102:6193 PA / Raw
Ether / IP / TCP 47.94.251.227:8280 > 172.29.27.102:6193 PA / Raw
